"No.","Time","Source","Destination","Protocol","Length","Info"
"1","0.000000","192.168.29.161","52.23.66.242","TCP","54","64968  >  443 [RST, ACK] Seq=1 Ack=1 Win=0 Len=0"
"2","0.502323","Arcadyan_fe:0a:0b","AzureWaveTec_01:dc:73","ARP","42","Who has 192.168.29.161? Tell 192.168.29.1"
"3","0.502382","AzureWaveTec_01:dc:73","Arcadyan_fe:0a:0b","ARP","42","192.168.29.161 is at 70:66:55:01:dc:73"
"4","0.582703","192.168.29.161","54.224.79.84","TLSv1.2","729","Application Data"
"5","0.582987","192.168.29.161","54.224.79.84","TLSv1.2","85","Application Data"
"6","0.833148","54.224.79.84","192.168.29.161","TCP","56","443  >  64260 [ACK] Seq=1 Ack=707 Win=771 Len=0"
"7","0.856765","54.224.79.84","192.168.29.161","TLSv1.2","316","Application Data"
"8","0.856765","54.224.79.84","192.168.29.161","TLSv1.2","85","Application Data"
"9","0.856838","192.168.29.161","54.224.79.84","TCP","54","64260  >  443 [ACK] Seq=707 Ack=294 Win=253 Len=0"
"10","1.886350","192.168.29.161","52.23.66.242","TCP","54","64954  >  443 [RST, ACK] Seq=1 Ack=1 Win=0 Len=0"
"11","2.650116","2405:201:7003:c0d5:2547:811:8a15:a967","2606:4700:4700::1001","TCP","86","65011  >  443 [SYN] Seq=0 Win=65535 Len=0 MSS=1440 WS=256 SACK_PERM"
"12","2.651096","2405:201:7003:c0d5:2547:811:8a15:a967","2606:4700:4700::1001","TCP","86","65012  >  443 [SYN] Seq=0 Win=65535 Len=0 MSS=1440 WS=256 SACK_PERM"
"13","2.653059","2405:201:7003:c0d5:2547:811:8a15:a967","2606:4700:4700::1001","TCP","86","65013  >  443 [SYN] Seq=0 Win=65535 Len=0 MSS=1440 WS=256 SACK_PERM"
"14","2.665228","2606:4700:4700::1001","2405:201:7003:c0d5:2547:811:8a15:a967","TCP","86","443  >  65012 [SYN, ACK] Seq=0 Ack=1 Win=65535 Len=0 MSS=1360 SACK_PERM WS=8192"
"15","2.665228","2606:4700:4700::1001","2405:201:7003:c0d5:2547:811:8a15:a967","TCP","86","443  >  65011 [SYN, ACK] Seq=0 Ack=1 Win=65535 Len=0 MSS=1360 SACK_PERM WS=8192"
"16","2.665349","2405:201:7003:c0d5:2547:811:8a15:a967","2606:4700:4700::1001","TCP","74","65012  >  443 [ACK] Seq=1 Ack=1 Win=65280 Len=0"
"17","2.665402","2405:201:7003:c0d5:2547:811:8a15:a967","2606:4700:4700::1001","TCP","74","65011  >  443 [ACK] Seq=1 Ack=1 Win=65280 Len=0"
"18","2.666085","2405:201:7003:c0d5:2547:811:8a15:a967","2606:4700:4700::1001","TLSv1.3","607","Client Hello (SNI=cloudflare-dns.com)"
"19","2.666121","2405:201:7003:c0d5:2547:811:8a15:a967","2606:4700:4700::1001","TLSv1.3","607","Client Hello (SNI=cloudflare-dns.com)"
"20","2.671837","2606:4700:4700::1001","2405:201:7003:c0d5:2547:811:8a15:a967","TCP","86","443  >  65013 [SYN, ACK] Seq=0 Ack=1 Win=65535 Len=0 MSS=1360 SACK_PERM WS=8192"
"21","2.671948","2405:201:7003:c0d5:2547:811:8a15:a967","2606:4700:4700::1001","TCP","74","65013  >  443 [ACK] Seq=1 Ack=1 Win=65280 Len=0"
"22","2.672561","2405:201:7003:c0d5:2547:811:8a15:a967","2606:4700:4700::1001","TLSv1.3","607","Client Hello (SNI=cloudflare-dns.com)"
"23","2.680852","2606:4700:4700::1001","2405:201:7003:c0d5:2547:811:8a15:a967","TCP","74","443  >  65012 [ACK] Seq=1 Ack=534 Win=131072 Len=0"
"24","2.682046","2606:4700:4700::1001","2405:201:7003:c0d5:2547:811:8a15:a967","TCP","74","443  >  65011 [ACK] Seq=1 Ack=534 Win=131072 Len=0"
"25","2.683091","2606:4700:4700::1001","2405:201:7003:c0d5:2547:811:8a15:a967","TLSv1.3","1434","Server Hello, Change Cipher Spec"
"26","2.683091","2606:4700:4700::1001","2405:201:7003:c0d5:2547:811:8a15:a967","TCP","1434","443  >  65012 [ACK] Seq=1361 Ack=534 Win=131072 Len=1360 [TCP PDU reassembled in 28]"
"27","2.683179","2405:201:7003:c0d5:2547:811:8a15:a967","2606:4700:4700::1001","TCP","74","65012  >  443 [ACK] Seq=534 Ack=2721 Win=65280 Len=0"
"28","2.683320","2606:4700:4700::1001","2405:201:7003:c0d5:2547:811:8a15:a967","TLSv1.3","676","Application Data"
"29","2.683562","2405:201:7003:c0d5:2547:811:8a15:a967","2606:4700:4700::1001","TLSv1.3","80","Change Cipher Spec"
"30","2.684249","2405:201:7003:c0d5:2547:811:8a15:a967","2606:4700:4700::1001","TLSv1.3","148","Application Data"
"31","2.684471","2606:4700:4700::1001","2405:201:7003:c0d5:2547:811:8a15:a967","TLSv1.3","1434","Server Hello, Change Cipher Spec"
"32","2.684471","2606:4700:4700::1001","2405:201:7003:c0d5:2547:811:8a15:a967","TCP","1434","443  >  65011 [ACK] Seq=1361 Ack=534 Win=131072 Len=1360 [TCP PDU reassembled in 35]"
"33","2.684529","2405:201:7003:c0d5:2547:811:8a15:a967","2606:4700:4700::1001","TLSv1.3","272","Application Data"
"34","2.684557","2405:201:7003:c0d5:2547:811:8a15:a967","2606:4700:4700::1001","TCP","74","65011  >  443 [ACK] Seq=534 Ack=2721 Win=65280 Len=0"
"35","2.684596","2606:4700:4700::1001","2405:201:7003:c0d5:2547:811:8a15:a967","TLSv1.3","677","Application Data"
"36","2.684791","2405:201:7003:c0d5:2547:811:8a15:a967","2606:4700:4700::1001","TLSv1.3","80","Change Cipher Spec"
"37","2.685529","2405:201:7003:c0d5:2547:811:8a15:a967","2606:4700:4700::1001","TLSv1.3","148","Application Data"
"38","2.685825","2405:201:7003:c0d5:2547:811:8a15:a967","2606:4700:4700::1001","TLSv1.3","272","Application Data"
"39","2.689668","2606:4700:4700::1001","2405:201:7003:c0d5:2547:811:8a15:a967","TCP","74","443  >  65013 [ACK] Seq=1 Ack=534 Win=131072 Len=0"
"40","2.693517","2606:4700:4700::1001","2405:201:7003:c0d5:2547:811:8a15:a967","TLSv1.3","1434","Server Hello, Change Cipher Spec"
"41","2.693517","2606:4700:4700::1001","2405:201:7003:c0d5:2547:811:8a15:a967","TCP","1434","443  >  65013 [ACK] Seq=1361 Ack=534 Win=131072 Len=1360 [TCP PDU reassembled in 43]"
"42","2.693612","2405:201:7003:c0d5:2547:811:8a15:a967","2606:4700:4700::1001","TCP","74","65013  >  443 [ACK] Seq=534 Ack=2721 Win=65280 Len=0"
"43","2.693758","2606:4700:4700::1001","2405:201:7003:c0d5:2547:811:8a15:a967","TLSv1.3","677","Application Data"
"44","2.693949","2405:201:7003:c0d5:2547:811:8a15:a967","2606:4700:4700::1001","TLSv1.3","80","Change Cipher Spec"
"45","2.694527","2405:201:7003:c0d5:2547:811:8a15:a967","2606:4700:4700::1001","TLSv1.3","148","Application Data"
"46","2.694777","2405:201:7003:c0d5:2547:811:8a15:a967","2606:4700:4700::1001","TLSv1.3","272","Application Data"
"47","2.698186","2606:4700:4700::1001","2405:201:7003:c0d5:2547:811:8a15:a967","TCP","74","443  >  65012 [ACK] Seq=3323 Ack=812 Win=131072 Len=0"
"48","2.698186","2606:4700:4700::1001","2405:201:7003:c0d5:2547:811:8a15:a967","TCP","74","443  >  65011 [ACK] Seq=3324 Ack=812 Win=131072 Len=0"
"49","2.701936","2606:4700:4700::1001","2405:201:7003:c0d5:2547:811:8a15:a967","TLSv1.3","1042","Application Data, Application Data"
"50","2.703186","2606:4700:4700::1001","2405:201:7003:c0d5:2547:811:8a15:a967","TLSv1.3","1186","Application Data, Application Data"
"51","2.713246","2606:4700:4700::1001","2405:201:7003:c0d5:2547:811:8a15:a967","TCP","74","443  >  65013 [ACK] Seq=3324 Ack=812 Win=131072 Len=0"
"52","2.714343","2606:4700:4700::1001","2405:201:7003:c0d5:2547:811:8a15:a967","TLSv1.3","944","Application Data, Application Data"
"53","2.717144","2405:201:7003:c0d5:2547:811:8a15:a967","2404:6800:4002:802::200e","QUIC","1292","Initial, DCID=c27dc271771004bf, PKN: 1, PADDING, PING, CRYPTO, PING, PING, PADDING, PING, PADDING, CRYPTO, PING, PADDING, PING, CRYPTO, CRYPTO, PING"
"54","2.717294","2405:201:7003:c0d5:2547:811:8a15:a967","2404:6800:4002:802::200e","QUIC","1292","Initial, DCID=c27dc271771004bf, PKN: 2, CRYPTO"
"55","2.717391","2405:201:7003:c0d5:2547:811:8a15:a967","2404:6800:4002:802::200e","QUIC","1292","Initial, DCID=c27dc271771004bf, PKN: 3, CRYPTO, PING, PING, PING, PADDING, PING, CRYPTO, PING, PING, PADDING, CRYPTO, PADDING, CRYPTO, PADDING, PING, CRYPTO, PING, PING, CRYPTO, PING, CRYPTO, CRYPTO, PADDING"
"56","2.717796","2405:201:7003:c0d5:2547:811:8a15:a967","2404:6800:4002:802::200e","QUIC","141","0-RTT, DCID=c27dc271771004bf"
"57","2.738649","2404:6800:4002:802::200e","2405:201:7003:c0d5:2547:811:8a15:a967","QUIC","102","Initial, SCID=e27dc271771004bf, PKN: 1, ACK"
"58","2.738649","2404:6800:4002:802::200e","2405:201:7003:c0d5:2547:811:8a15:a967","QUIC","102","Initial, SCID=e27dc271771004bf, PKN: 2, ACK"
"59","2.738767","2404:6800:4002:802::200e","2405:201:7003:c0d5:2547:811:8a15:a967","QUIC","1292","Initial, SCID=e27dc271771004bf, PKN: 3, ACK, PADDING"
"60","2.738767","2404:6800:4002:802::200e","2405:201:7003:c0d5:2547:811:8a15:a967","QUIC","1292","Initial, SCID=e27dc271771004bf, PKN: 4, ACK, PADDING"
"61","2.747524","2405:201:7003:c0d5:2547:811:8a15:a967","2606:4700:4700::1001","TCP","74","65012  >  443 [ACK] Seq=812 Ack=4435 Win=65280 Len=0"
"62","2.747524","2405:201:7003:c0d5:2547:811:8a15:a967","2606:4700:4700::1001","TCP","74","65011  >  443 [ACK] Seq=812 Ack=4292 Win=65280 Len=0"
"63","2.763644","2405:201:7003:c0d5:2547:811:8a15:a967","2606:4700:4700::1001","TCP","74","65013  >  443 [ACK] Seq=812 Ack=4194 Win=65280 Len=0"
"64","2.763670","2405:201:7003:c0d5:2547:811:8a15:a967","2404:6800:4002:802::200e","QUIC","1292","Initial, DCID=e27dc271771004bf, PKN: 6, PADDING, PING, PADDING"
"65","2.784089","2404:6800:4002:802::200e","2405:201:7003:c0d5:2547:811:8a15:a967","QUIC","1292","Initial, SCID=e27dc271771004bf, PKN: 5, ACK, PADDING"
"66","2.808246","2404:6800:4002:802::200e","2405:201:7003:c0d5:2547:811:8a15:a967","QUIC","1292","Initial, SCID=e27dc271771004bf, PKN: 6, CRYPTO, PADDING"
"67","2.808246","2404:6800:4002:802::200e","2405:201:7003:c0d5:2547:811:8a15:a967","QUIC","366","Protected Payload (KP0)"
"68","2.808387","2404:6800:4002:802::200e","2405:201:7003:c0d5:2547:811:8a15:a967","QUIC","988","Protected Payload (KP0)"
"69","2.808387","2404:6800:4002:802::200e","2405:201:7003:c0d5:2547:811:8a15:a967","QUIC","103","Protected Payload (KP0)"
"70","2.808387","2404:6800:4002:802::200e","2405:201:7003:c0d5:2547:811:8a15:a967","QUIC","86","Protected Payload (KP0)"
"71","2.809299","2405:201:7003:c0d5:2547:811:8a15:a967","2404:6800:4002:802::200e","QUIC","140","Handshake, DCID=e27dc271771004bf"
"72","2.809824","2405:201:7003:c0d5:2547:811:8a15:a967","2404:6800:4002:802::200e","QUIC","93","Protected Payload (KP0), DCID=e27dc271771004bf"
"73","2.811459","2405:201:7003:c0d5:2547:811:8a15:a967","2404:6800:4002:802::200e","QUIC","1288","Protected Payload (KP0), DCID=e27dc271771004bf"
"74","2.811911","2405:201:7003:c0d5:2547:811:8a15:a967","2404:6800:4002:802::200e","QUIC","1292","Protected Payload (KP0), DCID=e27dc271771004bf"
"75","2.812570","2405:201:7003:c0d5:2547:811:8a15:a967","2404:6800:4002:802::200e","QUIC","991","Protected Payload (KP0), DCID=e27dc271771004bf"
"76","2.812736","2405:201:7003:c0d5:2547:811:8a15:a967","2404:6800:4002:802::200e","QUIC","359","Protected Payload (KP0), DCID=e27dc271771004bf"
"77","2.812807","2405:201:7003:c0d5:2547:811:8a15:a967","2404:6800:4002:802::200e","QUIC","113","Protected Payload (KP0), DCID=e27dc271771004bf"
"78","2.813231","2405:201:7003:c0d5:2547:811:8a15:a967","2404:6800:4002:802::200e","QUIC","1286","Protected Payload (KP0), DCID=e27dc271771004bf"
"79","2.813352","2405:201:7003:c0d5:2547:811:8a15:a967","2404:6800:4002:802::200e","QUIC","1292","Protected Payload (KP0), DCID=e27dc271771004bf"
"80","2.813426","2405:201:7003:c0d5:2547:811:8a15:a967","2404:6800:4002:802::200e","QUIC","1292","Protected Payload (KP0), DCID=e27dc271771004bf"
"81","2.813513","2405:201:7003:c0d5:2547:811:8a15:a967","2404:6800:4002:802::200e","QUIC","476","Protected Payload (KP0), DCID=e27dc271771004bf"
"82","2.830197","2404:6800:4002:802::200e","2405:201:7003:c0d5:2547:811:8a15:a967","QUIC","182","Protected Payload (KP0)"
"83","2.830197","2404:6800:4002:802::200e","2405:201:7003:c0d5:2547:811:8a15:a967","QUIC","87","Protected Payload (KP0)"
"84","2.834633","2404:6800:4002:802::200e","2405:201:7003:c0d5:2547:811:8a15:a967","QUIC","87","Protected Payload (KP0)"
"85","2.834633","2404:6800:4002:802::200e","2405:201:7003:c0d5:2547:811:8a15:a967","QUIC","87","Protected Payload (KP0)"
"86","2.834808","2404:6800:4002:802::200e","2405:201:7003:c0d5:2547:811:8a15:a967","QUIC","91","Protected Payload (KP0)"
"87","2.834808","2404:6800:4002:802::200e","2405:201:7003:c0d5:2547:811:8a15:a967","QUIC","91","Protected Payload (KP0)"
"88","2.834808","2404:6800:4002:802::200e","2405:201:7003:c0d5:2547:811:8a15:a967","QUIC","87","Protected Payload (KP0)"
"89","2.835210","2405:201:7003:c0d5:2547:811:8a15:a967","2404:6800:4002:802::200e","QUIC","93","Protected Payload (KP0), DCID=e27dc271771004bf"
"90","2.873672","2405:201:7003:c0d5:2547:811:8a15:a967","2404:6800:4002:802::200e","QUIC","94","Protected Payload (KP0), DCID=e27dc271771004bf"
"91","2.893111","2404:6800:4002:802::200e","2405:201:7003:c0d5:2547:811:8a15:a967","QUIC","84","Protected Payload (KP0)"
"92","2.893460","2405:201:7003:c0d5:2547:811:8a15:a967","2404:6800:4002:802::200e","QUIC","95","Protected Payload (KP0), DCID=e27dc271771004bf"
"93","2.905484","192.168.29.161","44.209.130.107","TCP","54","64970  >  443 [RST, ACK] Seq=1 Ack=1 Win=0 Len=0"
"94","2.922538","2404:6800:4002:802::200e","2405:201:7003:c0d5:2547:811:8a15:a967","QUIC","663","Protected Payload (KP0)"
"95","2.922538","2404:6800:4002:802::200e","2405:201:7003:c0d5:2547:811:8a15:a967","QUIC","83","Protected Payload (KP0)"
"96","2.922970","2405:201:7003:c0d5:2547:811:8a15:a967","2404:6800:4002:802::200e","QUIC","99","Protected Payload (KP0), DCID=e27dc271771004bf"
"97","2.923111","2405:201:7003:c0d5:2547:811:8a15:a967","2404:6800:4002:802::200e","QUIC","95","Protected Payload (KP0), DCID=e27dc271771004bf"
"98","2.924982","2404:6800:4002:802::200e","2405:201:7003:c0d5:2547:811:8a15:a967","QUIC","744","Protected Payload (KP0)"
"99","2.924982","2404:6800:4002:802::200e","2405:201:7003:c0d5:2547:811:8a15:a967","QUIC","156","Protected Payload (KP0)"
"100","2.925857","2405:201:7003:c0d5:2547:811:8a15:a967","2404:6800:4002:802::200e","QUIC","99","Protected Payload (KP0), DCID=e27dc271771004bf"
"101","2.945337","2404:6800:4002:802::200e","2405:201:7003:c0d5:2547:811:8a15:a967","QUIC","85","Protected Payload (KP0)"
"102","2.953604","2405:201:7003:c0d5:2547:811:8a15:a967","2404:6800:4002:802::200e","QUIC","94","Protected Payload (KP0), DCID=e27dc271771004bf"
"103","3.295650","192.168.29.161","104.18.19.125","TLSv1.2","448","Application Data"
"104","3.295990","192.168.29.161","104.18.19.125","TLSv1.2","85","Application Data"
"105","3.307158","104.18.19.125","192.168.29.161","TCP","56","443  >  64239 [ACK] Seq=1 Ack=426 Win=18 Len=0"
"106","3.559168","104.18.19.125","192.168.29.161","TLSv1.2","135","Application Data"
"107","3.585001","192.168.29.161","54.224.79.84","TLSv1.2","684","Application Data"
"108","3.585628","192.168.29.161","54.224.79.84","TLSv1.2","85","Application Data"
"109","3.615589","192.168.29.161","104.18.19.125","TCP","54","64239  >  443 [ACK] Seq=426 Ack=82 Win=253 Len=0"
"110","3.835181","54.224.79.84","192.168.29.161","TCP","56","443  >  64260 [ACK] Seq=294 Ack=1368 Win=771 Len=0"
"111","3.886825","54.224.79.84","192.168.29.161","TLSv1.2","316","Application Data"
"112","3.886825","54.224.79.84","192.168.29.161","TLSv1.2","85","Application Data"
"113","3.886917","192.168.29.161","54.224.79.84","TCP","54","64260  >  443 [ACK] Seq=1368 Ack=587 Win=252 Len=0"
"114","4.078731","192.168.29.161","162.159.36.1","TLSv1.2","78","Application Data"
"115","4.078835","192.168.29.161","162.159.36.1","TCP","54","64834  >  443 [FIN, ACK] Seq=25 Ack=1 Win=255 Len=0"
"116","4.079070","192.168.29.161","162.159.36.1","TCP","66","65014  >  443 [SYN] Seq=0 Win=65535 Len=0 MSS=1460 WS=256 SACK_PERM"
"117","4.079098","192.168.29.161","162.159.36.1","TCP","66","65015  >  443 [SYN] Seq=0 Win=65535 Len=0 MSS=1460 WS=256 SACK_PERM"
"118","4.079267","192.168.29.161","162.159.36.1","TLSv1.2","78","Application Data"
"119","4.079346","192.168.29.161","162.159.36.1","TCP","54","64833  >  443 [FIN, ACK] Seq=25 Ack=1 Win=255 Len=0"
"120","4.080181","192.168.29.161","162.159.36.1","TCP","66","65016  >  443 [SYN] Seq=0 Win=65535 Len=0 MSS=1460 WS=256 SACK_PERM"
"121","4.094274","162.159.36.1","192.168.29.161","TCP","66","443  >  65016 [SYN, ACK] Seq=0 Ack=1 Win=65535 Len=0 MSS=1460 SACK_PERM WS=8192"
"122","4.094412","192.168.29.161","162.159.36.1","TCP","54","65016  >  443 [ACK] Seq=1 Ack=1 Win=65280 Len=0"
"123","4.095005","192.168.29.161","162.159.36.1","TLSv1.3","587","Client Hello (SNI=cloudflare-dns.com)"
"124","4.101487","162.159.36.1","192.168.29.161","TCP","54","443  >  64834 [FIN, ACK] Seq=1 Ack=25 Win=16 Len=0"
"125","4.101555","192.168.29.161","162.159.36.1","TCP","54","64834  >  443 [ACK] Seq=26 Ack=2 Win=255 Len=0"
"126","4.103314","162.159.36.1","192.168.29.161","TCP","66","443  >  65014 [SYN, ACK] Seq=0 Ack=1 Win=65535 Len=0 MSS=1460 SACK_PERM WS=8192"
"127","4.103434","192.168.29.161","162.159.36.1","TCP","54","65014  >  443 [ACK] Seq=1 Ack=1 Win=65280 Len=0"
"128","4.104127","192.168.29.161","162.159.36.1","TLSv1.3","587","Client Hello (SNI=cloudflare-dns.com)"
"129","4.104462","162.159.36.1","192.168.29.161","TCP","66","443  >  65015 [SYN, ACK] Seq=0 Ack=1 Win=65535 Len=0 MSS=1460 SACK_PERM WS=8192"
"130","4.104462","162.159.36.1","192.168.29.161","TCP","54","443  >  64834 [ACK] Seq=2 Ack=26 Win=16 Len=0"
"131","4.104650","192.168.29.161","162.159.36.1","TCP","54","65015  >  443 [ACK] Seq=1 Ack=1 Win=65280 Len=0"
"132","4.104835","162.159.36.1","192.168.29.161","TCP","54","443  >  64833 [FIN, ACK] Seq=1 Ack=26 Win=16 Len=0"
"133","4.104886","192.168.29.161","162.159.36.1","TCP","54","64833  >  443 [ACK] Seq=26 Ack=2 Win=255 Len=0"
"134","4.110385","162.159.36.1","192.168.29.161","TCP","54","443  >  65016 [ACK] Seq=1 Ack=534 Win=131072 Len=0"
"135","4.110385","162.159.36.1","192.168.29.161","TLSv1.3","306","Server Hello, Change Cipher Spec, Application Data"
"136","4.120059","192.168.29.161","162.159.36.1","TLSv1.3","587","Client Hello (SNI=cloudflare-dns.com)"
"137","4.120591","192.168.29.161","162.159.36.1","TLSv1.3","134","Change Cipher Spec, Application Data"
"138","4.120865","192.168.29.161","162.159.36.1","TLSv1.3","248","Application Data"
"139","4.126192","162.159.36.1","192.168.29.161","TCP","54","443  >  65014 [ACK] Seq=1 Ack=534 Win=131072 Len=0"
"140","4.128210","162.159.36.1","192.168.29.161","TLSv1.3","1514","Server Hello, Change Cipher Spec"
"141","4.128210","162.159.36.1","192.168.29.161","TCP","1514","443  >  65014 [ACK] Seq=1461 Ack=534 Win=131072 Len=1460 [TCP PDU reassembled in 143]"
"142","4.128334","192.168.29.161","162.159.36.1","TCP","54","65014  >  443 [ACK] Seq=534 Ack=2921 Win=65280 Len=0"
"143","4.128451","162.159.36.1","192.168.29.161","TLSv1.3","456","Application Data"
"144","4.128632","192.168.29.161","162.159.36.1","TLSv1.3","60","Change Cipher Spec"
"145","4.129361","192.168.29.161","162.159.36.1","TLSv1.3","128","Application Data"
"146","4.130170","192.168.29.161","162.159.36.1","TLSv1.3","248","Application Data"
"147","4.135552","162.159.36.1","192.168.29.161","TCP","56","443  >  65016 [ACK] Seq=253 Ack=808 Win=131072 Len=0"
"148","4.139991","162.159.36.1","192.168.29.161","TLSv1.3","928","Application Data, Application Data"
"149","4.143314","192.168.29.161","162.159.36.1","TLSv1.3","248","Application Data"
"150","4.144195","162.159.36.1","192.168.29.161","TCP","54","443  >  65015 [ACK] Seq=1 Ack=534 Win=131072 Len=0"
"151","4.145282","162.159.36.1","192.168.29.161","TLSv1.3","1514","Server Hello, Change Cipher Spec"
"152","4.145791","192.168.29.161","162.159.36.1","TLSv1.3","60","Change Cipher Spec"
"153","4.146398","162.159.36.1","192.168.29.161","TCP","1514","443  >  65015 [ACK] Seq=1461 Ack=534 Win=131072 Len=1460 [TCP PDU reassembled in 154]"
"154","4.146398","162.159.36.1","192.168.29.161","TLSv1.3","457","Application Data"
"155","4.146493","192.168.29.161","162.159.36.1","TCP","54","65015  >  443 [ACK] Seq=540 Ack=3324 Win=65280 Len=0"
"156","4.146996","192.168.29.161","162.159.36.1","TLSv1.3","128","Application Data"
"157","4.150537","162.159.36.1","192.168.29.161","TCP","56","443  >  65014 [ACK] Seq=3323 Ack=614 Win=131072 Len=0"
"158","4.155111","162.159.36.1","192.168.29.161","TLSv1.3","984","Application Data, Application Data"
"159","4.158749","162.159.36.1","192.168.29.161","TLSv1.3","534","Application Data"
"160","4.161151","2405:201:7003:c0d5:2547:811:8a15:a967","2404:6800:4003:c11::77","QUIC","1292","Initial, DCID=e6ce2d6b9597308a, PKN: 1, PING, PING, PING, PADDING, CRYPTO, CRYPTO, PING, CRYPTO, PING, PING, PING, PADDING, CRYPTO, PING, CRYPTO, CRYPTO, PADDING, CRYPTO, CRYPTO, PADDING, PING, CRYPTO, CRYPTO, CRYPTO, PADDING, PING, PADDING"
"161","4.161288","2405:201:7003:c0d5:2547:811:8a15:a967","2404:6800:4003:c11::77","QUIC","1292","Initial, DCID=e6ce2d6b9597308a, PKN: 2, CRYPTO"
"162","4.161376","2405:201:7003:c0d5:2547:811:8a15:a967","2404:6800:4003:c11::77","QUIC","1292","Initial, DCID=e6ce2d6b9597308a, PKN: 3, CRYPTO, PADDING, CRYPTO, PING, PING, CRYPTO, CRYPTO, PADDING"
"163","4.161765","2405:201:7003:c0d5:2547:811:8a15:a967","2404:6800:4003:c11::77","QUIC","141","0-RTT, DCID=e6ce2d6b9597308a"
"164","4.169163","162.159.36.1","192.168.29.161","TCP","56","443  >  65015 [ACK] Seq=3324 Ack=614 Win=131072 Len=0"
"165","4.195596","192.168.29.161","162.159.36.1","TCP","54","65014  >  443 [ACK] Seq=808 Ack=4253 Win=64000 Len=0"
"166","4.211608","192.168.29.161","162.159.36.1","TCP","54","65016  >  443 [ACK] Seq=1002 Ack=1607 Win=65280 Len=0"
"167","4.248148","192.168.29.1","224.0.0.1","IGMPv3","50","Membership Query, general"
"168","4.253897","2404:6800:4003:c11::77","2405:201:7003:c0d5:2547:811:8a15:a967","QUIC","102","Initial, SCID=e6ce2d6b9597308a, PKN: 1, ACK"
"169","4.253897","2404:6800:4003:c11::77","2405:201:7003:c0d5:2547:811:8a15:a967","QUIC","102","Initial, SCID=e6ce2d6b9597308a, PKN: 2, ACK"
"170","4.253998","2404:6800:4003:c11::77","2405:201:7003:c0d5:2547:811:8a15:a967","QUIC","1292","Initial, SCID=e6ce2d6b9597308a, PKN: 3, ACK, PADDING"
"171","4.253998","2404:6800:4003:c11::77","2405:201:7003:c0d5:2547:811:8a15:a967","QUIC","1292","Initial, SCID=e6ce2d6b9597308a, PKN: 4, ACK, PADDING"
"172","4.254957","2404:6800:4003:c11::77","2405:201:7003:c0d5:2547:811:8a15:a967","QUIC","1292","Initial, SCID=e6ce2d6b9597308a, PKN: 5, CRYPTO, PADDING"
"173","4.254957","2404:6800:4003:c11::77","2405:201:7003:c0d5:2547:811:8a15:a967","QUIC","362","Protected Payload (KP0)"
"174","4.255041","2404:6800:4003:c11::77","2405:201:7003:c0d5:2547:811:8a15:a967","QUIC","992","Protected Payload (KP0)"
"175","4.255041","2404:6800:4003:c11::77","2405:201:7003:c0d5:2547:811:8a15:a967","QUIC","91","Protected Payload (KP0)"
"176","4.255810","2405:201:7003:c0d5:2547:811:8a15:a967","2404:6800:4003:c11::77","QUIC","140","Handshake, DCID=e6ce2d6b9597308a"
"177","4.256027","2405:201:7003:c0d5:2547:811:8a15:a967","2404:6800:4003:c11::77","QUIC","93","Protected Payload (KP0), DCID=e6ce2d6b9597308a"
"178","4.278348","2404:6800:4003:c11::77","2405:201:7003:c0d5:2547:811:8a15:a967","QUIC","86","Protected Payload (KP0)"
"179","4.288720","2405:201:7003:c0d5:2547:811:8a15:a967","2404:6800:4003:c11::77","QUIC","94","Protected Payload (KP0), DCID=e6ce2d6b9597308a"
"180","4.343229","2404:6800:4003:c11::77","2405:201:7003:c0d5:2547:811:8a15:a967","QUIC","182","Protected Payload (KP0)"
"181","4.370424","fe80::1a82:8cff:fefe:a0b","ff02::1","ICMPv6","90","Multicast Listener Query"
"182","4.370645","fe80::f093:513c:9bc9:8793","ff02::16","ICMPv6","90","Multicast Listener Report Message v2"
"183","4.383932","2405:201:7003:c0d5:2547:811:8a15:a967","2404:6800:4003:c11::77","QUIC","94","Protected Payload (KP0), DCID=e6ce2d6b9597308a"
"184","4.399896","192.168.29.161","224.0.0.22","IGMPv3","70","Membership Report / Join group 224.0.0.252 for any sources / Join group 224.0.0.251 for any sources / Join group 239.255.255.250 for any sources"
"185","4.400033","fe80::f093:513c:9bc9:8793","ff02::16","ICMPv6","170","Multicast Listener Report Message v2"
"186","5.001370","192.168.29.161","54.224.79.84","TLSv1.2","685","Application Data"
"187","5.001677","192.168.29.161","54.224.79.84","TLSv1.2","85","Application Data"
"188","5.249911","54.224.79.84","192.168.29.161","TCP","56","443  >  64260 [ACK] Seq=587 Ack=2030 Win=771 Len=0"
"189","5.280461","54.224.79.84","192.168.29.161","TLSv1.2","316","Application Data"
"190","5.280461","54.224.79.84","192.168.29.161","TLSv1.2","85","Application Data"
"191","5.280531","192.168.29.161","54.224.79.84","TCP","54","64260  >  443 [ACK] Seq=2030 Ack=880 Win=251 Len=0"
"192","5.437678","192.168.29.161","162.159.46.1","TCP","66","65017  >  443 [SYN] Seq=0 Win=65535 Len=0 MSS=1460 WS=256 SACK_PERM"
"193","5.438773","192.168.29.161","162.159.46.1","TCP","66","65018  >  443 [SYN] Seq=0 Win=65535 Len=0 MSS=1460 WS=256 SACK_PERM"
"194","5.439738","192.168.29.161","162.159.46.1","TCP","66","65019  >  443 [SYN] Seq=0 Win=65535 Len=0 MSS=1460 WS=256 SACK_PERM"
"195","5.454154","192.168.29.161","162.159.46.1","TCP","66","65020  >  443 [SYN] Seq=0 Win=65535 Len=0 MSS=1460 WS=256 SACK_PERM"
"196","5.454498","162.159.46.1","192.168.29.161","TCP","66","443  >  65019 [SYN, ACK] Seq=0 Ack=1 Win=65535 Len=0 MSS=1460 SACK_PERM WS=8192"
"197","5.454645","192.168.29.161","162.159.46.1","TCP","54","65019  >  443 [ACK] Seq=1 Ack=1 Win=65280 Len=0"
"198","5.454993","192.168.29.161","162.159.46.1","TCP","66","65021  >  443 [SYN] Seq=0 Win=65535 Len=0 MSS=1460 WS=256 SACK_PERM"
"199","5.456190","192.168.29.161","162.159.46.1","TCP","66","65022  >  443 [SYN] Seq=0 Win=65535 Len=0 MSS=1460 WS=256 SACK_PERM"
"200","5.456180","192.168.29.161","162.159.46.1","TLSv1.3","587","Client Hello (SNI=cloudflare-dns.com)"
"201","5.461362","162.159.46.1","192.168.29.161","TCP","66","443  >  65018 [SYN, ACK] Seq=0 Ack=1 Win=65535 Len=0 MSS=1460 SACK_PERM WS=8192"
"202","5.461362","162.159.46.1","192.168.29.161","TCP","66","443  >  65017 [SYN, ACK] Seq=0 Ack=1 Win=65535 Len=0 MSS=1460 SACK_PERM WS=8192"
"203","5.461510","192.168.29.161","162.159.46.1","TCP","54","65018  >  443 [ACK] Seq=1 Ack=1 Win=65280 Len=0"
"204","5.461578","192.168.29.161","162.159.46.1","TCP","54","65017  >  443 [ACK] Seq=1 Ack=1 Win=65280 Len=0"
"205","5.470548","162.159.46.1","192.168.29.161","TCP","66","443  >  65021 [SYN, ACK] Seq=0 Ack=1 Win=65535 Len=0 MSS=1460 SACK_PERM WS=8192"
"206","5.470548","162.159.46.1","192.168.29.161","TCP","66","443  >  65022 [SYN, ACK] Seq=0 Ack=1 Win=65535 Len=0 MSS=1460 SACK_PERM WS=8192"
"207","5.470680","192.168.29.161","162.159.46.1","TCP","54","65021  >  443 [ACK] Seq=1 Ack=1 Win=65280 Len=0"
"208","5.470734","192.168.29.161","162.159.46.1","TCP","54","65022  >  443 [ACK] Seq=1 Ack=1 Win=65280 Len=0"
"209","5.471127","192.168.29.161","162.159.46.1","TLSv1.3","587","Client Hello (SNI=cloudflare-dns.com)"
"210","5.471797","192.168.29.161","162.159.46.1","TLSv1.3","587","Client Hello (SNI=cloudflare-dns.com)"
"211","5.472132","192.168.29.161","162.159.46.1","TCP","66","65023  >  443 [SYN] Seq=0 Win=65535 Len=0 MSS=1460 WS=256 SACK_PERM"
"212","5.472386","192.168.29.161","162.159.46.1","TCP","66","65024  >  443 [SYN] Seq=0 Win=65535 Len=0 MSS=1460 WS=256 SACK_PERM"
"213","5.472562","192.168.29.161","162.159.46.1","TLSv1.3","587","Client Hello (SNI=cloudflare-dns.com)"
"214","5.472699","192.168.29.161","162.159.46.1","TCP","66","65025  >  443 [SYN] Seq=0 Win=65535 Len=0 MSS=1460 WS=256 SACK_PERM"
"215","5.472789","162.159.46.1","192.168.29.161","TCP","54","443  >  65019 [ACK] Seq=1 Ack=534 Win=131072 Len=0"
"216","5.472868","192.168.29.161","162.159.46.1","TCP","66","65027  >  443 [SYN] Seq=0 Win=65535 Len=0 MSS=1460 WS=256 SACK_PERM"
"217","5.472868","192.168.29.161","162.159.46.1","TCP","66","65026  >  443 [SYN] Seq=0 Win=65535 Len=0 MSS=1460 WS=256 SACK_PERM"
"218","5.473057","192.168.29.161","162.159.46.1","TCP","66","65028  >  443 [SYN] Seq=0 Win=65535 Len=0 MSS=1460 WS=256 SACK_PERM"
"219","5.473195","192.168.29.161","162.159.46.1","TLSv1.3","587","Client Hello (SNI=cloudflare-dns.com)"
"220","5.473617","162.159.46.1","192.168.29.161","TLSv1.3","306","Server Hello, Change Cipher Spec, Application Data"
"221","5.474163","192.168.29.161","162.159.46.1","TLSv1.3","134","Change Cipher Spec, Application Data"
"222","5.474513","192.168.29.161","162.159.46.1","TLSv1.3","264","Application Data"
"223","5.476915","162.159.46.1","192.168.29.161","TCP","66","443  >  65020 [SYN, ACK] Seq=0 Ack=1 Win=65535 Len=0 MSS=1460 SACK_PERM WS=8192"
"224","5.477046","192.168.29.161","162.159.46.1","TCP","54","65020  >  443 [ACK] Seq=1 Ack=1 Win=65280 Len=0"
"225","5.477538","192.168.29.161","162.159.46.1","TLSv1.3","587","Client Hello (SNI=cloudflare-dns.com)"
"226","5.485481","162.159.46.1","192.168.29.161","TCP","66","443  >  65027 [SYN, ACK] Seq=0 Ack=1 Win=65535 Len=0 MSS=1460 SACK_PERM WS=8192"
"227","5.485481","162.159.46.1","192.168.29.161","TCP","54","443  >  65022 [ACK] Seq=1 Ack=534 Win=131072 Len=0"
"228","5.485602","192.168.29.161","162.159.46.1","TCP","54","65027  >  443 [ACK] Seq=1 Ack=1 Win=65280 Len=0"
"229","5.486322","192.168.29.161","162.159.46.1","TLSv1.3","587","Client Hello (SNI=cloudflare-dns.com)"
"230","5.487296","162.159.46.1","192.168.29.161","TLSv1.3","306","Server Hello, Change Cipher Spec, Application Data"
"231","5.487819","192.168.29.161","162.159.46.1","TLSv1.3","134","Change Cipher Spec, Application Data"
"232","5.488436","162.159.46.1","192.168.29.161","TCP","54","443  >  65021 [ACK] Seq=1 Ack=534 Win=131072 Len=0"
"233","5.488436","162.159.46.1","192.168.29.161","TLSv1.3","306","Server Hello, Change Cipher Spec, Application Data"
"234","5.488436","162.159.46.1","192.168.29.161","TCP","66","443  >  65024 [SYN, ACK] Seq=0 Ack=1 Win=65535 Len=0 MSS=1460 SACK_PERM WS=8192"
"235","5.488626","192.168.29.161","162.159.46.1","TCP","54","65024  >  443 [ACK] Seq=1 Ack=1 Win=65280 Len=0"
"236","5.488741","192.168.29.161","162.159.46.1","TLSv1.3","249","Application Data"
"237","5.489118","192.168.29.161","162.159.46.1","TLSv1.3","134","Change Cipher Spec, Application Data"
"238","5.489221","192.168.29.161","162.159.46.1","TLSv1.3","587","Client Hello (SNI=cloudflare-dns.com)"
"239","5.489382","192.168.29.161","162.159.46.1","TLSv1.3","249","Application Data"
"240","5.491652","162.159.46.1","192.168.29.161","TCP","56","443  >  65019 [ACK] Seq=253 Ack=824 Win=131072 Len=0"
"241","5.493289","162.159.46.1","192.168.29.161","TCP","66","443  >  65028 [SYN, ACK] Seq=0 Ack=1 Win=65535 Len=0 MSS=1460 SACK_PERM WS=8192"
"242","5.493412","192.168.29.161","162.159.46.1","TCP","54","65028  >  443 [ACK] Seq=1 Ack=1 Win=65280 Len=0"
"243","5.494061","192.168.29.161","162.159.46.1","TLSv1.3","320","Client Hello (SNI=cloudflare-dns.com)"
"244","5.496961","162.159.46.1","192.168.29.161","TCP","66","443  >  65025 [SYN, ACK] Seq=0 Ack=1 Win=65535 Len=0 MSS=1460 SACK_PERM WS=8192"
"245","5.497091","192.168.29.161","162.159.46.1","TCP","54","65025  >  443 [ACK] Seq=1 Ack=1 Win=65280 Len=0"
"246","5.497652","192.168.29.161","162.159.46.1","TLSv1.3","320","Client Hello (SNI=cloudflare-dns.com)"
"247","5.498511","162.159.46.1","192.168.29.161","TCP","54","443  >  65018 [ACK] Seq=1 Ack=534 Win=131072 Len=0"
"248","5.498511","162.159.46.1","192.168.29.161","TCP","66","443  >  65026 [SYN, ACK] Seq=0 Ack=1 Win=65535 Len=0 MSS=1460 SACK_PERM WS=8192"
"249","5.498511","162.159.46.1","192.168.29.161","TCP","66","443  >  65023 [SYN, ACK] Seq=0 Ack=1 Win=65535 Len=0 MSS=1460 SACK_PERM WS=8192"
"250","5.498670","192.168.29.161","162.159.46.1","TCP","54","65026  >  443 [ACK] Seq=1 Ack=1 Win=65280 Len=0"
"251","5.498741","192.168.29.161","162.159.46.1","TCP","54","65023  >  443 [ACK] Seq=1 Ack=1 Win=65280 Len=0"
"252","5.498853","162.159.46.1","192.168.29.161","TLSv1.3","1514","Server Hello, Change Cipher Spec"
"253","5.498853","162.159.46.1","192.168.29.161","TCP","1514","443  >  65018 [ACK] Seq=1461 Ack=534 Win=131072 Len=1460 [TCP PDU reassembled in 254]"
"254","5.498853","162.159.46.1","192.168.29.161","TLSv1.3","456","Application Data"
"255","5.498982","192.168.29.161","162.159.46.1","TCP","54","65018  >  443 [ACK] Seq=534 Ack=3323 Win=65280 Len=0"
"256","5.499431","192.168.29.161","162.159.46.1","TLSv1.3","320","Client Hello (SNI=cloudflare-dns.com)"
"257","5.499474","192.168.29.161","162.159.46.1","TLSv1.3","320","Client Hello (SNI=cloudflare-dns.com)"
"258","5.499854","192.168.29.161","162.159.46.1","TLSv1.3","134","Change Cipher Spec, Application Data"
"259","5.499933","162.159.46.1","192.168.29.161","TCP","54","443  >  65017 [ACK] Seq=1 Ack=534 Win=131072 Len=0"
"260","5.499933","162.159.46.1","192.168.29.161","TCP","54","443  >  65027 [ACK] Seq=1 Ack=534 Win=131072 Len=0"
"261","5.500012","162.159.46.1","192.168.29.161","TCP","54","443  >  65020 [ACK] Seq=1 Ack=534 Win=131072 Len=0"
"262","5.500012","162.159.46.1","192.168.29.161","TLSv1.3","1514","Server Hello, Change Cipher Spec"
"263","5.500129","192.168.29.161","162.159.46.1","TLSv1.3","264","Application Data"
"264","5.500367","192.168.29.161","162.159.46.1","TLSv1.3","60","Change Cipher Spec"
"265","5.501712","162.159.46.1","192.168.29.161","TCP","1514","443  >  65017 [ACK] Seq=1461 Ack=534 Win=131072 Len=1460 [TCP PDU reassembled in 266]"
"266","5.501712","162.159.46.1","192.168.29.161","TLSv1.3","455","Application Data"
"267","5.501712","162.159.46.1","192.168.29.161","TLSv1.3","1514","Server Hello, Change Cipher Spec"
"268","5.501824","192.168.29.161","162.159.46.1","TCP","54","65017  >  443 [ACK] Seq=540 Ack=3322 Win=65280 Len=0"
"269","5.502121","192.168.29.161","162.159.46.1","TLSv1.3","60","Change Cipher Spec"
"270","5.502496","192.168.29.161","162.159.46.1","TLSv1.3","128","Application Data"
"271","5.502759","192.168.29.161","162.159.46.1","TLSv1.3","264","Application Data"
"272","5.502830","162.159.46.1","192.168.29.161","TCP","1514","443  >  65027 [ACK] Seq=1461 Ack=534 Win=131072 Len=1460 [TCP PDU reassembled in 273]"
"273","5.502830","162.159.46.1","192.168.29.161","TLSv1.3","455","Application Data"
"274","5.502830","162.159.46.1","192.168.29.161","TLSv1.3","306","Server Hello, Change Cipher Spec, Application Data"
"275","5.502934","192.168.29.161","162.159.46.1","TCP","54","65027  >  443 [ACK] Seq=540 Ack=3322 Win=65280 Len=0"
"276","5.503007","162.159.46.1","192.168.29.161","TCP","56","443  >  65021 [ACK] Seq=253 Ack=809 Win=131072 Len=0"
"277","5.503457","192.168.29.161","162.159.46.1","TLSv1.3","128","Application Data"
"278","5.503757","192.168.29.161","162.159.46.1","TLSv1.3","246","Application Data"
"279","5.503896","162.159.46.1","192.168.29.161","TCP","56","443  >  65022 [ACK] Seq=253 Ack=809 Win=131072 Len=0"
"280","5.504172","192.168.29.161","162.159.46.1","TLSv1.3","134","Change Cipher Spec, Application Data"
"281","5.504441","192.168.29.161","162.159.46.1","TLSv1.3","249","Application Data"
"282","5.508049","162.159.46.1","192.168.29.161","TCP","54","443  >  65024 [ACK] Seq=1 Ack=534 Win=131072 Len=0"
"283","5.511026","162.159.46.1","192.168.29.161","TLSv1.3","1514","Server Hello, Change Cipher Spec"
"284","5.511026","162.159.46.1","192.168.29.161","TCP","1514","443  >  65024 [ACK] Seq=1461 Ack=534 Win=131072 Len=1460 [TCP PDU reassembled in 285]"
"285","5.511026","162.159.46.1","192.168.29.161","TLSv1.3","457","Application Data"
"286","5.511026","162.159.46.1","192.168.29.161","TLSv1.3","1025","Application Data, Application Data"
"287","5.511174","192.168.29.161","162.159.46.1","TCP","54","65024  >  443 [ACK] Seq=534 Ack=3324 Win=65280 Len=0"
"288","5.513352","192.168.29.161","162.159.46.1","TLSv1.3","134","Change Cipher Spec, Application Data"
"289","5.513673","192.168.29.161","162.159.46.1","TLSv1.3","261","Application Data"
"290","5.513973","192.168.29.161","162.159.46.1","TLSv1.3","246","Application Data"
"291","5.514198","162.159.46.1","192.168.29.161","TCP","54","443  >  65028 [ACK] Seq=1 Ack=267 Win=131072 Len=0"
"292","5.514198","162.159.46.1","192.168.29.161","TCP","56","443  >  65027 [ACK] Seq=3322 Ack=806 Win=131072 Len=0"
"293","5.515280","162.159.46.1","192.168.29.161","TLSv1.3","1514","Server Hello, Change Cipher Spec"
"294","5.515631","192.168.29.161","162.159.46.1","TLSv1.3","60","Change Cipher Spec"
"295","5.516183","162.159.46.1","192.168.29.161","TCP","1514","443  >  65028 [ACK] Seq=1461 Ack=267 Win=131072 Len=1460 [TCP PDU reassembled in 296]"
"296","5.516183","162.159.46.1","192.168.29.161","TLSv1.3","456","Application Data"
"297","5.516269","192.168.29.161","162.159.46.1","TCP","54","65028  >  443 [ACK] Seq=273 Ack=3323 Win=65280 Len=0"
"298","5.516793","192.168.29.161","162.159.46.1","TLSv1.3","128","Application Data"
"299","5.517010","192.168.29.161","162.159.46.1","TLSv1.3","261","Application Data"
"300","5.518569","162.159.46.1","192.168.29.161","TCP","54","443  >  65025 [ACK] Seq=1 Ack=267 Win=131072 Len=0"
"301","5.518569","162.159.46.1","192.168.29.161","TLSv1.3","1514","Server Hello, Change Cipher Spec"
"302","5.518942","192.168.29.161","162.159.46.1","TLSv1.3","60","Change Cipher Spec"
"303","5.519589","162.159.46.1","192.168.29.161","TCP","1514","443  >  65025 [ACK] Seq=1461 Ack=267 Win=131072 Len=1460 [TCP PDU reassembled in 304]"
"304","5.519589","162.159.46.1","192.168.29.161","TLSv1.3","456","Application Data"
"305","5.519719","192.168.29.161","162.159.46.1","TCP","54","65025  >  443 [ACK] Seq=273 Ack=3323 Win=65280 Len=0"
"306","5.520149","192.168.29.161","162.159.46.1","TLSv1.3","128","Application Data"
"307","5.520337","192.168.29.161","162.159.46.1","TLSv1.3","261","Application Data"
"308","5.521233","162.159.46.1","192.168.29.161","TCP","54","443  >  65023 [ACK] Seq=1 Ack=267 Win=131072 Len=0"
"309","5.523067","162.159.46.1","192.168.29.161","TLSv1.3","1514","Server Hello, Change Cipher Spec"
"310","5.523428","192.168.29.161","162.159.46.1","TLSv1.3","60","Change Cipher Spec"
"311","5.524099","162.159.46.1","192.168.29.161","TCP","1514","443  >  65023 [ACK] Seq=1461 Ack=267 Win=131072 Len=1460 [TCP PDU reassembled in 312]"
"312","5.524099","162.159.46.1","192.168.29.161","TLSv1.3","456","Application Data"
"313","5.524193","192.168.29.161","162.159.46.1","TCP","54","65023  >  443 [ACK] Seq=273 Ack=3323 Win=65280 Len=0"
"314","5.524320","162.159.46.1","192.168.29.161","TCP","54","443  >  65026 [ACK] Seq=1 Ack=267 Win=131072 Len=0"
"315","5.524795","192.168.29.161","162.159.46.1","TLSv1.3","128","Application Data"
"316","5.525072","192.168.29.161","162.159.46.1","TLSv1.3","246","Application Data"
"317","5.525242","162.159.46.1","192.168.29.161","TLSv1.3","1514","Server Hello, Change Cipher Spec"
"318","5.525242","162.159.46.1","192.168.29.161","TCP","1514","443  >  65026 [ACK] Seq=1461 Ack=267 Win=131072 Len=1460 [TCP PDU reassembled in 319]"
"319","5.525242","162.159.46.1","192.168.29.161","TLSv1.3","456","Application Data"
"320","5.525355","192.168.29.161","162.159.46.1","TCP","54","65026  >  443 [ACK] Seq=267 Ack=3323 Win=65280 Len=0"
"321","5.526227","192.168.29.161","162.159.46.1","TLSv1.3","134","Change Cipher Spec, Application Data"
"322","5.528122","162.159.46.1","192.168.29.161","TCP","56","443  >  65018 [ACK] Seq=3323 Ack=824 Win=131072 Len=0"
"323","5.528122","162.159.46.1","192.168.29.161","TCP","56","443  >  65017 [ACK] Seq=3322 Ack=824 Win=131072 Len=0"
"324","5.528201","162.159.46.1","192.168.29.161","TCP","56","443  >  65024 [ACK] Seq=3324 Ack=806 Win=131072 Len=0"
"325","5.528201","162.159.46.1","192.168.29.161","TLSv1.3","1070","Application Data, Application Data"
"326","5.529121","162.159.46.1","192.168.29.161","TLSv1.3","1019","Application Data, Application Data"
"327","5.529121","162.159.46.1","192.168.29.161","TLSv1.3","468","Application Data"
"328","5.529248","162.159.46.1","192.168.29.161","TLSv1.3","927","Application Data, Application Data"
"329","5.529248","162.159.46.1","192.168.29.161","TCP","56","443  >  65020 [ACK] Seq=253 Ack=809 Win=131072 Len=0"
"330","5.531598","162.159.46.1","192.168.29.161","TCP","56","443  >  65028 [ACK] Seq=3323 Ack=554 Win=131072 Len=0"
"331","5.532985","162.159.46.1","192.168.29.161","TLSv1.3","1039","Application Data, Application Data"
"332","5.533476","2405:201:7003:c0d5:2547:811:8a15:a967","2606:4700:4700::1001","TLSv1.3","276","Application Data"
"333","5.534298","162.159.46.1","192.168.29.161","TLSv1.3","966","Application Data, Application Data"
